[{"_id":"ff04a315207fc3717c9c5c07","defaultProfile":"Default","store":{"Default":{"dia":3,"carbratio":[{"time":"00:00","value":6,"timeAsSeconds":0},{"time":"04:00","value":5,"timeAsSeconds":14400},{"time":"11:30","value":6,"timeAsSeconds":41400},{"time":"18:00","value":6,"timeAsSeconds":64800}],"carbs_hr":35,"delay":20,"sens":[{"time":"00:00","value":40,"timeAsSeconds":0}],"timezone":"Japan","basal":[{"time":"00:00","value":0,"timeAsSeconds":0},{"time":"08:00","value":7,"timeAsSeconds":28800},{"time":"09:00","value":0,"timeAsSeconds":32400}],"target_low":[{"time":"00:00","value":70,"timeAsSeconds":0}],"target_high":[{"time":"00:00","value":180,"timeAsSeconds":0}],"startDate":"1970-01-01T00:00:00.000Z","units":"mg/dl"}},"startDate":"1970-01-01T00:00:00.000Z","mills":0,"created_at":"2026-04-01T10:44:40.847Z","srvModified":1775040280847,"units":"mg/dl"}]